{
  "$schema": "https://json-schema.org/draft/2020-12/schema",
  "title": "MeasurementsEntry",
  "type": "object",
  "required": [
    "userId",
    "date",
    "body"
  ],
  "properties": {
    "userId": {
      "type": "string"
    },
    "date": {
      "type": "string",
      "format": "date"
    },
    "body": {
      "type": "object",
      "properties": {
        "weightKg": {
          "type": "number",
          "minimum": 0
        },
        "bodyFatPct": {
          "type": "number",
          "minimum": 0,
          "maximum": 80
        },
        "waistCm": {
          "type": "number",
          "minimum": 0
        },
        "hipsCm": {
          "type": "number",
          "minimum": 0
        },
        "chestCm": {
          "type": "number",
          "minimum": 0
        },
        "thighCm": {
          "type": "number",
          "minimum": 0
        },
        "armCm": {
          "type": "number",
          "minimum": 0
        }
      },
      "additionalProperties": false
    },
    "photos": {
      "type": "array",
      "items": {
        "type": "object",
        "required": [
          "uri",
          "createdAt"
        ],
        "properties": {
          "uri": {
            "type": "string"
          },
          "createdAt": {
            "type": "string",
            "format": "date-time"
          },
          "pose": {
            "type": "string",
            "enum": [
              "front",
              "side",
              "back",
              "custom"
            ]
          },
          "poseCustom": {
            "type": "string"
          },
          "notes": {
            "type": "string"
          }
        },
        "additionalProperties": false
      }
    }
  },
  "additionalProperties": false
}